"DESCRIPTION","DURATION IN MS","NAME","PARENT SUITE","START TIME","STATUS","STOP TIME","SUB SUITE","SUITE","TEST CLASS","TEST METHOD"
"","1006","Add backpack and verify in cart","chromium","2026-06-24","passed","2026-06-24","","cart.spec.ts","",""
"","1085","Checkout with valid information","chromium","2026-06-24","passed","2026-06-24","","Checkout.spec.ts","",""
"","855","Complete order Successfully","chromium","2026-06-24","passed","2026-06-24","","Checkout.spec.ts","",""
"","5530","Intentional failure test","chromium","2026-06-24","failed","2026-06-24","","login.spec.ts","",""
"","5692","Intentional failure during order confirmation","chromium","2026-06-24","failed","2026-06-24","","Checkout.spec.ts","",""
"","520","Invalid username should display error message","chromium","2026-06-24","passed","2026-06-24","","login.spec.ts","",""
"","477","Invalid password should display error message","chromium","2026-06-24","passed","2026-06-24","","login.spec.ts","",""
"","625","Valid login should navigate to inventory page","chromium","2026-06-24","passed","2026-06-24","","login.spec.ts","",""
